{
  "$defs": {
    "RebuildEvidenceV1": {
      "description": "Comprehensive, evidence-based causal rebuild model for developer artifacts.",
      "properties": {
        "active_guard_deferred": {
          "default": false,
          "type": "boolean"
        },
        "active_project_state": {
          "type": "string"
        },
        "known_artifact_convention": {
          "type": "boolean"
        },
        "lockfile_path": {
          "type": [
            "string",
            "null"
          ]
        },
        "lockfile_present": {
          "type": "boolean"
        },
        "manifest_path": {
          "type": [
            "string",
            "null"
          ]
        },
        "manifest_present": {
          "type": "boolean"
        },
        "project_root_known": {
          "type": "boolean"
        },
        "reasons": {
          "items": {
            "type": "string"
          },
          "type": "array"
        },
        "rebuild_command_template": {
          "type": [
            "string",
            "null"
          ]
        },
        "reconstruction_confidence": {
          "type": "string"
        },
        "toolchain_identified": {
          "type": [
            "string",
            "null"
          ]
        }
      },
      "required": [
        "manifest_present",
        "lockfile_present",
        "known_artifact_convention",
        "project_root_known",
        "active_project_state",
        "reconstruction_confidence",
        "reasons"
      ],
      "type": "object"
    }
  },
  "$schema": "https://json-schema.org/draft/2020-12/schema",
  "description": "Detailed inspection view for a single developer artifact.",
  "properties": {
    "allocated_bytes": {
      "format": "uint64",
      "minimum": 0,
      "type": "integer"
    },
    "artifact_id": {
      "type": "string"
    },
    "artifact_kind": {
      "type": "string"
    },
    "candidate_id": {
      "type": [
        "string",
        "null"
      ]
    },
    "confirmed_reclaim_lower_bound": {
      "format": "uint64",
      "minimum": 0,
      "type": "integer"
    },
    "display_name": {
      "type": "string"
    },
    "display_path": {
      "type": "string"
    },
    "ecosystem": {
      "type": "string"
    },
    "estimated_reclaim": {
      "format": "uint64",
      "minimum": 0,
      "type": "integer"
    },
    "logical_bytes": {
      "format": "uint64",
      "minimum": 0,
      "type": "integer"
    },
    "observed_at": {
      "type": "string"
    },
    "physical_sharing_uncertainty": {
      "type": "boolean"
    },
    "project_id": {
      "type": "string"
    },
    "project_name": {
      "type": "string"
    },
    "rebuild_evidence": {
      "$ref": "#/$defs/RebuildEvidenceV1"
    },
    "schema_version": {
      "type": "string"
    }
  },
  "required": [
    "schema_version",
    "artifact_id",
    "project_id",
    "project_name",
    "display_name",
    "display_path",
    "ecosystem",
    "artifact_kind",
    "logical_bytes",
    "allocated_bytes",
    "confirmed_reclaim_lower_bound",
    "estimated_reclaim",
    "physical_sharing_uncertainty",
    "rebuild_evidence",
    "observed_at"
  ],
  "title": "DeveloperArtifactDetailV1",
  "type": "object"
}
